{
  "requestId": "exec.req.001",
  "principalId": "principal.user.steve",
  "sessionId": "session.voice.001",
  "origin": "VOICE",
  "intent": "turn lounge light on",
  "targetResources": [
    "ha.light.lounge"
  ],
  "proposedActions": [
    "CONTROL"
  ],
  "priority": "NORMAL",
  "riskEstimate": "LOW",
  "createdAt": "2026-07-02T00:00:00Z",
  "expiresAt": "2026-07-02T00:05:00Z",
  "correlationId": "corr.001",
  "metadata": {}
}
